person_id,ability,program,title,skill,embedding_text,similarity_percentage
4072,"Over 7 years of extensive experience as Front- End Web Developer specializing in responsive web design development; Presenting in all phases of SDLC like Requirement Analysis, Design, Development, Implementation and Testing; Extensively followed iterative methodologies such as Agile (SCRUM) and test-driven development in multi project implementations; Expertise in Client-side scripting and Validations using JavaScript and jQuery; Experience in Object Oriented JavaScript and use of design patterns like module, revealing module and singleton pattern; Experience in using Angular, Node.JS to create a Single Page Applications (SPA), which can bind data to specific views and synchronize data with server; Remarkable knowledge of Design, Normalization and Database Management Concepts; Handling the response data from RESTful web services using XML, JSON and jQuery to update UI and built the task runners GRUNT, GULP in a very proficient way; Experience in implementing Mongo DB CRUD (Create Read Update Delete) operations by using Mongoose library in Node-JS including Angular JS; Effective skills of working with Eclipse IDE and MVC 4.0; Specialized in Developing Web 2.0 Apps using core jQuery along with AJAX/JavaScript; Knowledge working on developing web applications using PHP 5 and MySQL, SQL Server; Have Knowledge in developing Drupal custom modules inDrupal 7 version; Good understanding of Document Object Model (DOM) and DOM functions; Have knowledge on Core Java with strong understanding and working knowledge of Object Oriented Concepts like Collections, Multi-Threading, Exception Handling, Inheritance and Polymorphism; Proficient in using different IDE tools like Eclipse, NetBeansfor successful implementation of my projects; Present as a team player, quick learner, self-starter with effective communication, motivation and giving 100% with the positive thinking in exploring new technologies",Bachelors in Computer Science,Frontend Developer,JavaScript; Angular 2; jQuery; HTML5; Mongo Db; Node JS; DOM; MVC; AJAX; Grunt; Jasmine; Angular JS; Apache server; npm; Bootstrap; CSS3; JSON,"Over 7 years of extensive experience as Front- End Web Developer specializing in responsive web design development; Presenting in all phases of SDLC like Requirement Analysis, Design, Development, Implementation and Testing; Extensively followed iterative methodologies such as Agile (SCRUM) and test-driven development in multi project implementations; Expertise in Client-side scripting and Validations using JavaScript and jQuery; Experience in Object Oriented JavaScript and use of design patterns like module, revealing module and singleton pattern; Experience in using Angular, Node.JS to create a Single Page Applications (SPA), which can bind data to specific views and synchronize data with server; Remarkable knowledge of Design, Normalization and Database Management Concepts; Handling the response data from RESTful web services using XML, JSON and jQuery to update UI and built the task runners GRUNT, GULP in a very proficient way; Experience in implementing Mongo DB CRUD (Create Read Update Delete) operations by using Mongoose library in Node-JS including Angular JS; Effective skills of working with Eclipse IDE and MVC 4.0; Specialized in Developing Web 2.0 Apps using core jQuery along with AJAX/JavaScript; Knowledge working on developing web applications using PHP 5 and MySQL, SQL Server; Have Knowledge in developing Drupal custom modules inDrupal 7 version; Good understanding of Document Object Model (DOM) and DOM functions; Have knowledge on Core Java with strong understanding and working knowledge of Object Oriented Concepts like Collections, Multi-Threading, Exception Handling, Inheritance and Polymorphism; Proficient in using different IDE tools like Eclipse, NetBeansfor successful implementation of my projects; Present as a team player, quick learner, self-starter with effective communication, motivation and giving 100% with the positive thinking in exploring new technologies | Frontend DeveloperFrontend DeveloperFrontend Developer | JavaScript; Angular 2; jQuery; HTML5; Mongo Db; Node JS; DOM; MVC; AJAX; Grunt; Jasmine; Angular JS; Apache server; npm; Bootstrap; CSS3; JSON",71.32
4983,"14 years of programming experience in Web development; 10 years of professional experience in developing User Interface for web applications and for some desktop applications; Designing web applications with HTML5, XML, JavaScript (ECMA6), JSON, CSS3 and BootStrap3; Experience with Angular 1 Directives, Dependency Injection, Services, Routing, pipes, Forms; Experience with working on High Traffic Websites; Implementing the design to meet Web standards (W3C), on various browsers for cross-browser implementation; Experience dealing with CSS pre-processors SASS; Expertise in using source code control systems such as GIT, JIRA, Jenkins and Perforce; Experience with JavaScript Design Patterns: Module, Module Revealed, Prototype (OOP), Prototype Revealed, Singleton; Experience using JavaScript libraries such as JQuery, React, Jasmine, lodash, underscore, moment, some experience with D3, express; Hands on expertise in working with the JavaScript frameworks like Angular JS, Angular 6, Node JS, Aurelia JS and Backbone JS; Experience in creating single page applications using Angular JS 1.x, HTML5, bootstrap3, Angular, Restful Web API; Experience in JavaScript and involved in writing application level code to interact with APIs, Web Services using JSON; Experience in all phases of Software development life cycle (SDLC), which includes User Interaction, Business Analysis/Modeling, Design/Architecture, Development, Implementation, Integration, Documentation, Testing, and Deployment; Good experience in working with the SCRUM Methodology for Agile development (JIRA is our platform); Good practical knowledge in Object Oriented Programming, also knowledge in OOP in JavaScript (Prototyping, new classes in ecma6 and object creation with Object and literals); Experience in creating Web solutions using Responsive Web Design (RWD) and Bootstrap; Good understanding of Document Object Model (DOM); Good experience in Responsive Web Design and making web pages cross browser compatible; Experience in debugging and troubleshooting the existing code using debugger tools like Chrome developer toolbar, also using Firefox Developer Edition, and to identify problems in the initial stages and execute quick resolutions; Good understanding of HTTP Verbs and Learning, acquiring knowledge on MongoDB and Mongoose; Back- end experience with PHP (YII), MySQL, SQL Server and SQL Language; Experience with C#, report tools; Excellent communication skills, team player, quick learner and self-motivated",Bachelors of Computer Science in Computer Science,Frontend Web Developer,HTML5; CSS3; Bootstrap; JavaScript; React JS; Angular JS; JQuery; Backbone; Sencha; ExtJS; C#; Ajax; Typescript; Aurelia JS; CSS; HTML; Underscore; Angular 1.x; Require JS; node; Jasmine; AJAX; SQL Server; Handlebars; NodeJS; PHP; YII framework; MySQL; LINQ; Crystal Reports,"14 years of programming experience in Web development; 10 years of professional experience in developing User Interface for web applications and for some desktop applications; Designing web applications with HTML5, XML, JavaScript (ECMA6), JSON, CSS3 and BootStrap3; Experience with Angular 1 Directives, Dependency Injection, Services, Routing, pipes, Forms; Experience with working on High Traffic Websites; Implementing the design to meet Web standards (W3C), on various browsers for cross-browser implementation; Experience dealing with CSS pre-processors SASS; Expertise in using source code control systems such as GIT, JIRA, Jenkins and Perforce; Experience with JavaScript Design Patterns: Module, Module Revealed, Prototype (OOP), Prototype Revealed, Singleton; Experience using JavaScript libraries such as JQuery, React, Jasmine, lodash, underscore, moment, some experience with D3, express; Hands on expertise in working with the JavaScript frameworks like Angular JS, Angular 6, Node JS, Aurelia JS and Backbone JS; Experience in creating single page applications using Angular JS 1.x, HTML5, bootstrap3, Angular, Restful Web API; Experience in JavaScript and involved in writing application level code to interact with APIs, Web Services using JSON; Experience in all phases of Software development life cycle (SDLC), which includes User Interaction, Business Analysis/Modeling, Design/Architecture, Development, Implementation, Integration, Documentation, Testing, and Deployment; Good experience in working with the SCRUM Methodology for Agile development (JIRA is our platform); Good practical knowledge in Object Oriented Programming, also knowledge in OOP in JavaScript (Prototyping, new classes in ecma6 and object creation with Object and literals); Experience in creating Web solutions using Responsive Web Design (RWD) and Bootstrap; Good understanding of Document Object Model (DOM); Good experience in Responsive Web Design and making web pages cross browser compatible; Experience in debugging and troubleshooting the existing code using debugger tools like Chrome developer toolbar, also using Firefox Developer Edition, and to identify problems in the initial stages and execute quick resolutions; Good understanding of HTTP Verbs and Learning, acquiring knowledge on MongoDB and Mongoose; Back- end experience with PHP (YII), MySQL, SQL Server and SQL Language; Experience with C#, report tools; Excellent communication skills, team player, quick learner and self-motivated | Frontend Web DeveloperFrontend Web DeveloperFrontend Web Developer | HTML5; CSS3; Bootstrap; JavaScript; React JS; Angular JS; JQuery; Backbone; Sencha; ExtJS; C#; Ajax; Typescript; Aurelia JS; CSS; HTML; Underscore; Angular 1.x; Require JS; node; Jasmine; AJAX; SQL Server; Handlebars; NodeJS; PHP; YII framework; MySQL; LINQ; Crystal Reports",70.32
5877,"Over 8 years of experience as PHP Developer and Front-End Developer; Solid knowledge in MVC (Model View Controller) Framework using Laravel and Symfony Framework; Experienced in MEAN (MongoDB, Express, Angular and Node.js) stack on Single Page Applications (SPA) development; Proficient in creating AngularJS factories to utilize AngularJS services like $http to make RESTful API calls to PHP, Java, and Node.js based backend; Solid knowledge in Angular UI Bootstrap, Angular Material, and Font Awesome to add functionalities to the AngularJS based user interface; Experienced in using different JavaScript based packages libraries like Node.js, D3.js for complementary support to the web-based application; Experience in CSS3 preprocessors such as SASS, LESS to optimize the cascading style sheet and allow mix-ins, variables and hierarchical structure in CSS file; Strong experience in Responsive Web Applications using CSS3 Media Queries and Bootstrap for different layout according to the users device; Experience in handling JSON parsing along with AJAX calls to render the web pages with dynamic content; Strong experience in testing and handling cross-browser compatibility issues across various browsers and platforms using polyfill solutions like Modernizr and Webshim; Hands-on experience in frontend development testing tools, such as Jasmine, Karma, Mocha, Chai and QUnit; Experience with version control tools GIT and SVN, JavaScript package management tools NPM and Bower; Strong knowledge of Web Services using XML, SOAP, WSDL and REST; Hands-on experience on collaboration tools such as JIRA and Confluence; Experienced in developing Agile Methodology, Test-Driven Development (TDD) and continuous integration and deployment; Extended experience in CMS (Content Management Systems) such as WordPress, Drupal, and Magento; Solid understanding in latest trends, technologies and approaches for SOA based development and good understanding of SOA life cycle, SOA design principle, Service registry and various other SOA infrastructures; Creating Wireframes using popular tools. Like Balsamiq; Handled and managed data in Databases like MySQL, PostgreSQL and SQL Server in writing Stored Procedures, Constraints, Indexes, View; Excellent documentation skills with the ability to meet project deadlines and work in a cross-functional environment; Strong analytical capabilities, ability to quickly learn new technologies and adapt to new environments, great logical thinking and grasping ability; Experienced in designing web-based, data-driven applications and data management systems; Up to date knowledge with the latest industry trends. Ability to manage commitments to project deadlines, and under strict time constraints; Authorized to work in the US for any employer",,PHP / MySQL Developer,HTML; JQuery; CSS; JSON; JavaScript; MYSQL; MS Office; PHP; PSD; LAMP Stack; MVC; Laravel Framework; Scrum; HTML5; Ajax; Apache Tomcat Server; CSS3; Lamp Stack; XML; Magento; GIT; Photoshop; Angular; Angular 4; Bootstrap; Jasmine; Node.js; SASS; Karma; Linux; Agile/Scrum; RESTful; REST APIs; Angular.JS; Grunt; TDD; Mocha; Git; XSL; JIRA; SOAP; Unix Shell,"Over 8 years of experience as PHP Developer and Front-End Developer; Solid knowledge in MVC (Model View Controller) Framework using Laravel and Symfony Framework; Experienced in MEAN (MongoDB, Express, Angular and Node.js) stack on Single Page Applications (SPA) development; Proficient in creating AngularJS factories to utilize AngularJS services like $http to make RESTful API calls to PHP, Java, and Node.js based backend; Solid knowledge in Angular UI Bootstrap, Angular Material, and Font Awesome to add functionalities to the AngularJS based user interface; Experienced in using different JavaScript based packages libraries like Node.js, D3.js for complementary support to the web-based application; Experience in CSS3 preprocessors such as SASS, LESS to optimize the cascading style sheet and allow mix-ins, variables and hierarchical structure in CSS file; Strong experience in Responsive Web Applications using CSS3 Media Queries and Bootstrap for different layout according to the users device; Experience in handling JSON parsing along with AJAX calls to render the web pages with dynamic content; Strong experience in testing and handling cross-browser compatibility issues across various browsers and platforms using polyfill solutions like Modernizr and Webshim; Hands-on experience in frontend development testing tools, such as Jasmine, Karma, Mocha, Chai and QUnit; Experience with version control tools GIT and SVN, JavaScript package management tools NPM and Bower; Strong knowledge of Web Services using XML, SOAP, WSDL and REST; Hands-on experience on collaboration tools such as JIRA and Confluence; Experienced in developing Agile Methodology, Test-Driven Development (TDD) and continuous integration and deployment; Extended experience in CMS (Content Management Systems) such as WordPress, Drupal, and Magento; Solid understanding in latest trends, technologies and approaches for SOA based development and good understanding of SOA life cycle, SOA design principle, Service registry and various other SOA infrastructures; Creating Wireframes using popular tools. Like Balsamiq; Handled and managed data in Databases like MySQL, PostgreSQL and SQL Server in writing Stored Procedures, Constraints, Indexes, View; Excellent documentation skills with the ability to meet project deadlines and work in a cross-functional environment; Strong analytical capabilities, ability to quickly learn new technologies and adapt to new environments, great logical thinking and grasping ability; Experienced in designing web-based, data-driven applications and data management systems; Up to date knowledge with the latest industry trends. Ability to manage commitments to project deadlines, and under strict time constraints; Authorized to work in the US for any employer | PHP / MySQL DeveloperPHP / MySQL DeveloperPHP / MySQL Developer | HTML; JQuery; CSS; JSON; JavaScript; MYSQL; MS Office; PHP; PSD; LAMP Stack; MVC; Laravel Framework; Scrum; HTML5; Ajax; Apache Tomcat Server; CSS3; Lamp Stack; XML; Magento; GIT; Photoshop; Angular; Angular 4; Bootstrap; Jasmine; Node.js; SASS; Karma; Linux; Agile/Scrum; RESTful; REST APIs; Angular.JS; Grunt; TDD; Mocha; Git; XSL; JIRA; SOAP; Unix Shell",70.01
12129,"Over 6+ years of experience in developing an application using JavaScript, Reactjs HTML5 /DHTML, DOM, XHTML, jQuery, CSS3, and Ajax; Experience in Software life cycle phases like Requirement Analysis, Implementation and estimating the time-lines for the project; Very strong knowledge in Object Oriented Analysis and Designing, Object oriented programming and Design Patterns; Expert in developing User Interface (UI) applications and professional web applications using JavaScript, Reactjs HTML5 /DHTML; Experience in using Software development methodologies such as Agile and Waterfall; Solid working experience in various IDEs: Atom, Visual Studio, Notepad++, Sublime Text, Eclipse, etc; Very good experience in Document Object Model (DOM) and have a strong understanding of DOM Functions, alongside experienced in dealing with challenging High Traffic Websites and Cross Browser Issues handling; Expert in handling Twitter Bootstrap framework i.e., the concept of Grids, making using of advance components like Navs, Nav bars, Pagination, Alerts, Progress bars etc; Expertise in maintaining the websites, software, modifying and understanding the existing code; Hands on experience with object oriented JavaScript code and responsible for client side validation using Angular Directives and JQuery functions; Used JSON object for object manipulation in front end; Experience in using various JavaScript Web application related libraries such as JQuery, NodeJS, AngularJS, REDUX, and Bootstrap; Well versed with multiple version control tools like GIT Hub; Experience in Service Oriented Architecture using Web Services like Soap& Restful; Excellent communication and interpersonal skills; Strong research, analytical, computing skills; Ability to work independently and adapt quickly to emerging new technologies",Master of science in Information Assurance; Bachelor of Technology; ; SSC,UI Frontend Developer,HTML5; CSS3; JavaScript; JQuery; AJAX; GRAPHQL; RestAPI; NodeJS; React; Webpack; bootstrap; Gulp; Wordpress; Jenkins; JSON; jQuery; React Bootstrap; DHTML; DOM functions; XML; JSP; XHTML; Adobe Photoshop; Jira; Java; J2EE; Servlets; Struts; Oracle Database; CSS; HTML; Java Beans; AngularJS; Multithreading; JDBC; Spring Web Services; Design Patterns; Spring MVC; Spring Framework; Hibernate; Angular JS; SQL; Log4j,"Over 6+ years of experience in developing an application using JavaScript, Reactjs HTML5 /DHTML, DOM, XHTML, jQuery, CSS3, and Ajax; Experience in Software life cycle phases like Requirement Analysis, Implementation and estimating the time-lines for the project; Very strong knowledge in Object Oriented Analysis and Designing, Object oriented programming and Design Patterns; Expert in developing User Interface (UI) applications and professional web applications using JavaScript, Reactjs HTML5 /DHTML; Experience in using Software development methodologies such as Agile and Waterfall; Solid working experience in various IDEs: Atom, Visual Studio, Notepad++, Sublime Text, Eclipse, etc; Very good experience in Document Object Model (DOM) and have a strong understanding of DOM Functions, alongside experienced in dealing with challenging High Traffic Websites and Cross Browser Issues handling; Expert in handling Twitter Bootstrap framework i.e., the concept of Grids, making using of advance components like Navs, Nav bars, Pagination, Alerts, Progress bars etc; Expertise in maintaining the websites, software, modifying and understanding the existing code; Hands on experience with object oriented JavaScript code and responsible for client side validation using Angular Directives and JQuery functions; Used JSON object for object manipulation in front end; Experience in using various JavaScript Web application related libraries such as JQuery, NodeJS, AngularJS, REDUX, and Bootstrap; Well versed with multiple version control tools like GIT Hub; Experience in Service Oriented Architecture using Web Services like Soap& Restful; Excellent communication and interpersonal skills; Strong research, analytical, computing skills; Ability to work independently and adapt quickly to emerging new technologies | UI Frontend DeveloperUI Frontend DeveloperUI Frontend Developer | HTML5; CSS3; JavaScript; JQuery; AJAX; GRAPHQL; RestAPI; NodeJS; React; Webpack; bootstrap; Gulp; Wordpress; Jenkins; JSON; jQuery; React Bootstrap; DHTML; DOM functions; XML; JSP; XHTML; Adobe Photoshop; Jira; Java; J2EE; Servlets; Struts; Oracle Database; CSS; HTML; Java Beans; AngularJS; Multithreading; JDBC; Spring Web Services; Design Patterns; Spring MVC; Spring Framework; Hibernate; Angular JS; SQL; Log4j",69.9
