person_id,ability,program,title,skill,embedding_text,similarity_percentage
8379,"designing and developing enterprise level applications; B2C and B2B projects; Authorized to work in the US for any employer; Gathered technical requirements and performed requirement analysis, risk analysis; Collaborated closely with product owner, stakeholders/clients, marketing team, technical team; Acted as liaison between technical team and clients; Elicited product requirements to technical team; Worked on wireframes, DFDs, flow charts and WBS; Exercised on both mobile applications and web applications; Estimated ETA for the projects along with technical team; Executed project management, resource allocation, team management and CRM; Held responsible for project planning, release planning, sprint planning, triage meetings and post implementation support; Performed UAT, functional testing for the support; Created and maintained documentation - wireframes, BRDs, use cases, acceptance criteria, user stories, RFPs; Facilitated communication, problem solving, meetings, meeting invitation, jotting down and sending over minutes of meeting; Analyzed change requests and enhancements to projects; Generated weekly status reports and distributed to stakeholders and upper management; Participated in organizing events, event handling and training sessions; Monitored project specified scope is within time, cost, and quality objectives; Respond to emails, technical problems, prioritize and adopt to change, performed technical research to find solution; Research methodology - Agile, Scrum, Kanban; Java, JSP, HTML, CSS, JavaScript, Web Services, MySQL - Online shopping store; HTML, CSS, JavaScript - Designed a website for recycling tech products; Machine Learning - Data Science - Studied test data over Linear Regression, logistic, decision tree, SVM, Naïve Bayes, Random forest and KNN using Python; Android mobile programming - A short friends app in android studio using firebase as DB. Tested on emulator",Bachelors in Computer Science; MS Computer Science student,IT Business Analyst / Project Manager / Scrum Master,"DOCUMENTATION; FUNCTIONAL TESTING; PROJECT MANAGEMENT; RISK ANALYSIS; TEAM MANAGEMENT; Agile - Scrum, SDLC; Requirement gathering; Change and Risk analysis; UAT; Functional testing; User experience; Wireframes; Documentation; Strategic planning; Project management; Team management; Process analysis; Java, JSP, MySQL; JavaScript, HTML, CSS; Mobile programming","designing and developing enterprise level applications; B2C and B2B projects; Authorized to work in the US for any employer; Gathered technical requirements and performed requirement analysis, risk analysis; Collaborated closely with product owner, stakeholders/clients, marketing team, technical team; Acted as liaison between technical team and clients; Elicited product requirements to technical team; Worked on wireframes, DFDs, flow charts and WBS; Exercised on both mobile applications and web applications; Estimated ETA for the projects along with technical team; Executed project management, resource allocation, team management and CRM; Held responsible for project planning, release planning, sprint planning, triage meetings and post implementation support; Performed UAT, functional testing for the support; Created and maintained documentation - wireframes, BRDs, use cases, acceptance criteria, user stories, RFPs; Facilitated communication, problem solving, meetings, meeting invitation, jotting down and sending over minutes of meeting; Analyzed change requests and enhancements to projects; Generated weekly status reports and distributed to stakeholders and upper management; Participated in organizing events, event handling and training sessions; Monitored project specified scope is within time, cost, and quality objectives; Respond to emails, technical problems, prioritize and adopt to change, performed technical research to find solution; Research methodology - Agile, Scrum, Kanban; Java, JSP, HTML, CSS, JavaScript, Web Services, MySQL - Online shopping store; HTML, CSS, JavaScript - Designed a website for recycling tech products; Machine Learning - Data Science - Studied test data over Linear Regression, logistic, decision tree, SVM, Naïve Bayes, Random forest and KNN using Python; Android mobile programming - A short friends app in android studio using firebase as DB. Tested on emulator | IT Business Analyst / Project Manager / Scrum MasterIT Business Analyst / Project Manager / Scrum MasterIT Business Analyst / Project Manager / Scrum Master | DOCUMENTATION; FUNCTIONAL TESTING; PROJECT MANAGEMENT; RISK ANALYSIS; TEAM MANAGEMENT; Agile - Scrum, SDLC; Requirement gathering; Change and Risk analysis; UAT; Functional testing; User experience; Wireframes; Documentation; Strategic planning; Project management; Team management; Process analysis; Java, JSP, MySQL; JavaScript, HTML, CSS; Mobile programming",82.01
8692,"Craft Master with over 5 years experience in project management; Well Rounded with a Bachelors degree in Computer Science and a MBA; Capable of making critical project commitment decisions and maintain a high attention to detail in all your work; Technologically Savvy with experience in Agile, Scrum, MS Dynamics, CRM, Bug Tools, JIRA and Microsoft Office Suite; Communicator capable of expressing thoughts and ideas in a concise, clear and easily digestible manner; A Multi-Tasking Maven capable of juggling multiple deadlines and goals; Thrive on technical challenges and take pride in solving them; Strategic thinking both technically and business-wise",Master of International Business in International Business; Bachelor of Engineering in Computer and Information Sciences,Project Manager,"Work with DQMs; Developed Utilization tool; Developed Unevaluated Aging Report; Defined requirements; Developed and maintained implementation and enhancement project plans; Create and managed project roadmaps; Incorporated Agile Methodology; Use MS Project; Managed the deployment of Microsoft Global Marketing Ops marketing mobile tools; Facilitated communications and acted as vendor and interdepartmental liaison; Drove strategy and identified new opportunities for growth for online marketing channels; Managed four plus (4+) projects simultaneously; Analyzed campaign data, identified actionable opportunities, and measured and reported upon performance; Reviewed field actuals for productivity and production analysis; Represented Windows Phone merchandising at major developer events; Drove tools and process improvements; Publish weekly Collection concepts; Oversee a team of Merchandising Managers; Managed testing and rating of Windows Phone applications and Indi games; Collaborate with Tools PM/PO to deliver merchandising business requirements and online system; Developed, implemented, and managed Windows Phone experiential marketing projects; Coordinate with Xbox, Nokia and MSFT Business Groups joint merchandising x-platform promotions; Track pipeline and proactively identify roadblocks to pass Certifications; Create and analyze performance reports to track progress and maximize merchandising effectiveness; Actively participated in reviewing and testing of a complex internal programming and publishing Microsoft tool; Managed the development, launch, and expansion of the mobile app experience for Windows Phone","Craft Master with over 5 years experience in project management; Well Rounded with a Bachelors degree in Computer Science and a MBA; Capable of making critical project commitment decisions and maintain a high attention to detail in all your work; Technologically Savvy with experience in Agile, Scrum, MS Dynamics, CRM, Bug Tools, JIRA and Microsoft Office Suite; Communicator capable of expressing thoughts and ideas in a concise, clear and easily digestible manner; A Multi-Tasking Maven capable of juggling multiple deadlines and goals; Thrive on technical challenges and take pride in solving them; Strategic thinking both technically and business-wise | Project ManagerProject ManagerProject Manager | Work with DQMs; Developed Utilization tool; Developed Unevaluated Aging Report; Defined requirements; Developed and maintained implementation and enhancement project plans; Create and managed project roadmaps; Incorporated Agile Methodology; Use MS Project; Managed the deployment of Microsoft Global Marketing Ops marketing mobile tools; Facilitated communications and acted as vendor and interdepartmental liaison; Drove strategy and identified new opportunities for growth for online marketing channels; Managed four plus (4+) projects simultaneously; Analyzed campaign data, identified actionable opportunities, and measured and reported upon performance; Reviewed field actuals for productivity and production analysis; Represented Windows Phone merchandising at major developer events; Drove tools and process improvements; Publish weekly Collection concepts; Oversee a team of Merchandising Managers; Managed testing and rating of Windows Phone applications and Indi games; Collaborate with Tools PM/PO to deliver merchandising business requirements and online system; Developed, implemented, and managed Windows Phone experiential marketing projects; Coordinate with Xbox, Nokia and MSFT Business Groups joint merchandising x-platform promotions; Track pipeline and proactively identify roadblocks to pass Certifications; Create and analyze performance reports to track progress and maximize merchandising effectiveness; Actively participated in reviewing and testing of a complex internal programming and publishing Microsoft tool; Managed the development, launch, and expansion of the mobile app experience for Windows Phone",81.66
9338,"10+ years of progressive experience managing global teams to deploy complex digital and IT solutions; 7+ years of experience managing scrum sprints by using the core tenets of the scrum framework; Successfully managing project budgets and tracking financials that range from $10K to $1M; Developing strategic short-, mid-, and long-term project plans and identifying key interdependencies; Proficient in: MS Office, MS Project, Merlin, Basecamp, Smartsheet, Asana, Visio, JIRA, Confluence, SharePoint, Salesforce, OVPs, iWork, CSS, HTML, XML, PHP, Java Script, Dreamweaver, Photoshop, and Mixpanel; Defining, tracking, and communicating project milestones, scope of work, and resource allocation; Ensuring accurate project reporting and decision making through high-quality, integrated project plans; Liaising between business and technical areas to achieve on-time, on-budget, and on-spec completions; Merging customer/user needs with business requirements, budgetary restrictions, and logistical considerations; Using excellent project/process knowledge to manage projects critical paths and navigate project risks; Developing key deliverables by overseeing team-level and corporate-level processes effectively; Identifying, evaluating, and developing systems to meet business user requirements; Monitoring project status and analyzing/improving technical processes, systems, and procedures",Master in Science and Technology Leadership; Master of Science in Entertainment Business; Bachelor of Arts in Communication Studies,IT Security Program Manager,"Leading complex technical projects; Provide project management and coordination of security projects; Effectively lead and motivate client engagement teams; Define technical and business requirements for threat & vulnerability management solutions; Produce reports documenting discoveries during the engagement; Led complex technical projects; Managed validation, profile management system, and data migration projects; Ensured deliverables are achieved on schedule, under budget, and within quality standards; Defined, tracked, and communicated project milestones, scope of work, and resource allocations; Performed long-term planning and daily tasks management; Monitored project status to prevent problems and resolve any issues; Proactively analyzed and improved technical processes, systems, and procedures; Completed major projects for delivery in APAC, AFME, LATAM, EEU, and EU regions; Grew and utilized productive relationships with Agencies, technical teams, and vendors; Assessed development time, costs, and risks and creating SOWs, CRFs, and cost/risk assessments; Managed highly technical software development projects from conception to implementation; Adhered to tight budgets and kept projects on track to ensure completion within all specifications; Used Scrum best practices and values to plan and implement multiple complex initiatives; Maintained a project plan outlining tasks, milestones, status, and resource allocation; Collaborated professionally with cross functional teams in a variety of disciplines; Oversaw projects to optimize Marketing landing pages and registration forms in Marketo and Drupal; Established project standards and developed/analyzed metrics to monitor project effectiveness; Created detailed on-boarding documentation (including SOWs), for technology team members; Managed historical project documentation for technologies and implications for IT architecture; Managed complex projects involving multiple vendors, consultants, and leading edge technologies; Completed highly technical initiatives with broad implications for the overall IT architecture; Led multiple teams of 6-10 IT professional concurrently (2-6 simultaneous projects); Delivered projects requiring extensive systems integration and multiple technical platforms; Led the implementation of a new email marketing platform and migrate users (60K+ staff); Oversaw server-side gateway and software integrations with multiple banks and e-payment platforms; Led the migration of 60,000+ pieces of content from one OVP (Online Video Platform) to another; Developed project plans and defined purpose, roles, risks, tasks, milestones, and measures of success; Aided product strategy development for backend engineers, frontend engineers, and UX/UI designers; Facilitated project access to visual designers and analytics team as needed; Conducted research and engaged with stakeholders to develop roadmaps, use cases, scenarios, and backlogs; Hired to a full time position after two months contracting due to exceptional performance; Built and strengthened inter-departmental relationships throughout iHeartRadios web user groups; Established and increased transparency of digital objectives, processes, policies and standards; Supported 152+ markets and 2,000 digital properties for users in the US, Australia, and New Zealand; Improved user experience and identified areas for improvement with marketing/station personnel; Migrated 1M+ users from home grown marketing platform to Salesforce ExactTarget platform; Developed and tested product concepts and business plans for new product initiatives; Worked with operations, sales, marketing, development, technology, and other departments; Planned, tested, launched, and projects, communicating defects, enhancements, maintenance/issues; Led training and developed material to support editorial, web design, and technology functions; Researched usability trends/industry standards for opportunities to incorporate new practices and technologies","10+ years of progressive experience managing global teams to deploy complex digital and IT solutions; 7+ years of experience managing scrum sprints by using the core tenets of the scrum framework; Successfully managing project budgets and tracking financials that range from $10K to $1M; Developing strategic short-, mid-, and long-term project plans and identifying key interdependencies; Proficient in: MS Office, MS Project, Merlin, Basecamp, Smartsheet, Asana, Visio, JIRA, Confluence, SharePoint, Salesforce, OVPs, iWork, CSS, HTML, XML, PHP, Java Script, Dreamweaver, Photoshop, and Mixpanel; Defining, tracking, and communicating project milestones, scope of work, and resource allocation; Ensuring accurate project reporting and decision making through high-quality, integrated project plans; Liaising between business and technical areas to achieve on-time, on-budget, and on-spec completions; Merging customer/user needs with business requirements, budgetary restrictions, and logistical considerations; Using excellent project/process knowledge to manage projects critical paths and navigate project risks; Developing key deliverables by overseeing team-level and corporate-level processes effectively; Identifying, evaluating, and developing systems to meet business user requirements; Monitoring project status and analyzing/improving technical processes, systems, and procedures | IT Security Program ManagerIT Security Program ManagerIT Security Program Manager | Leading complex technical projects; Provide project management and coordination of security projects; Effectively lead and motivate client engagement teams; Define technical and business requirements for threat & vulnerability management solutions; Produce reports documenting discoveries during the engagement; Led complex technical projects; Managed validation, profile management system, and data migration projects; Ensured deliverables are achieved on schedule, under budget, and within quality standards; Defined, tracked, and communicated project milestones, scope of work, and resource allocations; Performed long-term planning and daily tasks management; Monitored project status to prevent problems and resolve any issues; Proactively analyzed and improved technical processes, systems, and procedures; Completed major projects for delivery in APAC, AFME, LATAM, EEU, and EU regions; Grew and utilized productive relationships with Agencies, technical teams, and vendors; Assessed development time, costs, and risks and creating SOWs, CRFs, and cost/risk assessments; Managed highly technical software development projects from conception to implementation; Adhered to tight budgets and kept projects on track to ensure completion within all specifications; Used Scrum best practices and values to plan and implement multiple complex initiatives; Maintained a project plan outlining tasks, milestones, status, and resource allocation; Collaborated professionally with cross functional teams in a variety of disciplines; Oversaw projects to optimize Marketing landing pages and registration forms in Marketo and Drupal; Established project standards and developed/analyzed metrics to monitor project effectiveness; Created detailed on-boarding documentation (including SOWs), for technology team members; Managed historical project documentation for technologies and implications for IT architecture; Managed complex projects involving multiple vendors, consultants, and leading edge technologies; Completed highly technical initiatives with broad implications for the overall IT architecture; Led multiple teams of 6-10 IT professional concurrently (2-6 simultaneous projects); Delivered projects requiring extensive systems integration and multiple technical platforms; Led the implementation of a new email marketing platform and migrate users (60K+ staff); Oversaw server-side gateway and software integrations with multiple banks and e-payment platforms; Led the migration of 60,000+ pieces of content from one OVP (Online Video Platform) to another; Developed project plans and defined purpose, roles, risks, tasks, milestones, and measures of success; Aided product strategy development for backend engineers, frontend engineers, and UX/UI designers; Facilitated project access to visual designers and analytics team as needed; Conducted research and engaged with stakeholders to develop roadmaps, use cases, scenarios, and backlogs; Hired to a full time position after two months contracting due to exceptional performance; Built and strengthened inter-departmental relationships throughout iHeartRadios web user groups; Established and increased transparency of digital objectives, processes, policies and standards; Supported 152+ markets and 2,000 digital properties for users in the US, Australia, and New Zealand; Improved user experience and identified areas for improvement with marketing/station personnel; Migrated 1M+ users from home grown marketing platform to Salesforce ExactTarget platform; Developed and tested product concepts and business plans for new product initiatives; Worked with operations, sales, marketing, development, technology, and other departments; Planned, tested, launched, and projects, communicating defects, enhancements, maintenance/issues; Led training and developed material to support editorial, web design, and technology functions; Researched usability trends/industry standards for opportunities to incorporate new practices and technologies",81.29
